{
  "$schema": "https://json-schema.org/draft/2020-12/schema",
  "title": "content/activity.json — 每日動態（只增不減，一個事件一筆）",
  "type": "array",
  "items": {
    "type": "object",
    "required": [
      "id",
      "date",
      "ts",
      "bot",
      "kind",
      "title",
      "summary",
      "nodes",
      "links",
      "parentId"
    ],
    "additionalProperties": false,
    "properties": {
      "id": {
        "type": "string",
        "pattern": "^[a-z0-9][a-z0-9-]{2,80}$"
      },
      "date": {
        "type": "string",
        "pattern": "^\\d{4}-\\d{2}-\\d{2}$"
      },
      "ts": {
        "type": "string",
        "pattern": "^\\d{4}-\\d{2}-\\d{2}T\\d{2}:\\d{2}(:\\d{2})?(Z|[+-]\\d{2}:\\d{2})$"
      },
      "bot": {
        "enum": [
          "merlin",
          "decomposer",
          "radar",
          "director",
          "intp",
          "designer",
          "integrator",
          "reviewer",
          "unknown"
        ]
      },
      "kind": {
        "enum": [
          "content",
          "video",
          "code",
          "fix",
          "review",
          "merge",
          "cleanup",
          "docs",
          "design"
        ]
      },
      "title": {
        "type": "string",
        "minLength": 1,
        "maxLength": 200
      },
      "summary": {
        "type": "string",
        "maxLength": 2000
      },
      "nodes": {
        "type": "array",
        "maxItems": 50,
        "items": {
          "type": "string",
          "pattern": "^[A-Za-z0-9_-]{1,80}$"
        }
      },
      "links": {
        "type": "array",
        "maxItems": 20,
        "items": {
          "type": "object",
          "required": [
            "label",
            "url"
          ],
          "additionalProperties": false,
          "properties": {
            "label": {
              "type": "string",
              "maxLength": 100
            },
            "url": {
              "type": "string",
              "pattern": "^https://[^\\s<>\"'`\\\\]+$",
              "maxLength": 500
            }
          }
        }
      },
      "parentId": {
        "type": [
          "string",
          "null"
        ]
      },
      "author": {
        "type": "string",
        "maxLength": 80
      }
    }
  }
}
