[
  {
    "id": "git-4108321",
    "date": "2026-10-10",
    "ts": "2026-10-10T22:02:25+08:00",
    "bot": "unknown",
    "kind": "code",
    "title": "建立網站：AI 認知邊界問題鏈",
    "summary": "第一版網站（單一 index.html）。commit 沒有標註是哪個 bot 做的。",
    "nodes": [],
    "links": [
      {
        "label": "commit 4108321",
        "url": "https://github.com/keqingwu5-cloud/ai-boundary/commit/4108321f97a304dc5209ef0c1efe7f47d733844a"
      }
    ],
    "parentId": null,
    "author": "keqingwu5-cloud"
  },
  {
    "id": "git-c1db8df",
    "date": "2026-10-10",
    "ts": "2026-10-10T22:07:14+08:00",
    "bot": "unknown",
    "kind": "design",
    "title": "改版：3D 動態問題樹",
    "summary": "自動旋轉、生長動畫、流動粒子、詳情面板。",
    "nodes": [],
    "links": [
      {
        "label": "commit c1db8df",
        "url": "https://github.com/keqingwu5-cloud/ai-boundary/commit/c1db8df6f4d809a21eb32499b1800b205fac6a9b"
      }
    ],
    "parentId": "git-4108321",
    "author": "keqingwu5-cloud"
  },
  {
    "id": "git-73824c0",
    "date": "2026-10-10",
    "ts": "2026-10-10T22:19:37+08:00",
    "bot": "unknown",
    "kind": "code",
    "title": "v1：3D 動態認知大腦",
    "summary": "Three.js、分裂、子腦、跨腦連結、歷史與匯出入。",
    "nodes": [],
    "links": [
      {
        "label": "commit 73824c0",
        "url": "https://github.com/keqingwu5-cloud/ai-boundary/commit/73824c0b79c4d01e804e0a46cf8475096589406c"
      }
    ],
    "parentId": "git-c1db8df",
    "author": "keqingwu5-cloud"
  },
  {
    "id": "git-75e90c7",
    "date": "2026-10-10",
    "ts": "2026-10-10T22:32:29+08:00",
    "bot": "unknown",
    "kind": "code",
    "title": "概念線＋分裂成子問題／新方向",
    "summary": "Concept threads + split into sub-questions / new directions。",
    "nodes": [],
    "links": [
      {
        "label": "commit 75e90c7",
        "url": "https://github.com/keqingwu5-cloud/ai-boundary/commit/75e90c71ec46450ab352b0545b99f8088775e88e"
      }
    ],
    "parentId": "git-73824c0",
    "author": "keqingwu5-cloud"
  },
  {
    "id": "git-4b45ed3",
    "date": "2026-10-10",
    "ts": "2026-10-10T23:00:32+08:00",
    "bot": "unknown",
    "kind": "code",
    "title": "短影音模式 feed.html",
    "summary": "大腦深層連結、影片欄位、giscus 留言依 bot 分流。",
    "nodes": [],
    "links": [
      {
        "label": "commit 4b45ed3",
        "url": "https://github.com/keqingwu5-cloud/ai-boundary/commit/4b45ed32ae16dbb015ffc0be55172678a6901e87"
      }
    ],
    "parentId": "git-73824c0",
    "author": "keqingwu5-cloud"
  },
  {
    "id": "git-abd3a61",
    "date": "2026-10-10",
    "ts": "2026-10-10T23:49:59+08:00",
    "bot": "director",
    "kind": "video",
    "title": "發佈 EP01 → n_q1",
    "summary": "同一個 commit 新增 SEED_MEDIA 與 scripts/publish_episode.sh（之後每一集都用它發佈）。",
    "nodes": [
      "n_q1"
    ],
    "links": [
      {
        "label": "commit abd3a61",
        "url": "https://github.com/keqingwu5-cloud/ai-boundary/commit/abd3a6151096068707b0e49bc4ca5dbec259dfe2"
      }
    ],
    "parentId": "git-4b45ed3",
    "author": "keqingwu5-cloud"
  },
  {
    "id": "content-n-x-language",
    "date": "2026-10-10",
    "ts": "2026-10-10T23:49:59+08:00",
    "bot": "intp",
    "kind": "content",
    "title": "新節點：語言是不是思考的邊界？（n_x_language）",
    "summary": "放進 SEED_EXTRAS，接在 n_q4 底下；節點資料標註 bot：INTP 鏡像研究員。跟 EP01 同一個 commit。",
    "nodes": [
      "n_x_language",
      "n_q4"
    ],
    "links": [
      {
        "label": "commit abd3a61",
        "url": "https://github.com/keqingwu5-cloud/ai-boundary/commit/abd3a6151096068707b0e49bc4ca5dbec259dfe2"
      }
    ],
    "parentId": null,
    "author": "keqingwu5-cloud"
  },
  {
    "id": "git-104c959",
    "date": "2026-10-10",
    "ts": "2026-10-10T23:51:51+08:00",
    "bot": "director",
    "kind": "video",
    "title": "發佈 EP02 → n_q2",
    "summary": "用 scripts/publish_episode.sh 發佈。",
    "nodes": [
      "n_q2"
    ],
    "links": [
      {
        "label": "commit 104c959",
        "url": "https://github.com/keqingwu5-cloud/ai-boundary/commit/104c959124560370ab29067581301ecac4cc2396"
      }
    ],
    "parentId": "git-abd3a61",
    "author": "keqingwu5-cloud"
  },
  {
    "id": "git-ef6ef60",
    "date": "2026-10-10",
    "ts": "2026-10-10T23:51:54+08:00",
    "bot": "director",
    "kind": "video",
    "title": "發佈 EP03 → n_q3",
    "summary": "用 scripts/publish_episode.sh 發佈。",
    "nodes": [
      "n_q3"
    ],
    "links": [
      {
        "label": "commit ef6ef60",
        "url": "https://github.com/keqingwu5-cloud/ai-boundary/commit/ef6ef603268db8767fd91a57871979180e747f3e"
      }
    ],
    "parentId": "git-abd3a61",
    "author": "keqingwu5-cloud"
  },
  {
    "id": "git-bfb79b9",
    "date": "2026-10-10",
    "ts": "2026-10-10T23:51:57+08:00",
    "bot": "director",
    "kind": "video",
    "title": "發佈 EP04 → n_q4",
    "summary": "用 scripts/publish_episode.sh 發佈。",
    "nodes": [
      "n_q4"
    ],
    "links": [
      {
        "label": "commit bfb79b9",
        "url": "https://github.com/keqingwu5-cloud/ai-boundary/commit/bfb79b97049e68db807e1e09c05a74986e482775"
      }
    ],
    "parentId": "git-abd3a61",
    "author": "keqingwu5-cloud"
  },
  {
    "id": "git-421b7a5",
    "date": "2026-10-10",
    "ts": "2026-10-10T23:58:04+08:00",
    "bot": "director",
    "kind": "video",
    "title": "發佈 EP05 → n_q5",
    "summary": "用 scripts/publish_episode.sh 發佈。",
    "nodes": [
      "n_q5"
    ],
    "links": [
      {
        "label": "commit 421b7a5",
        "url": "https://github.com/keqingwu5-cloud/ai-boundary/commit/421b7a52a5530f48cbea0a877f405ddc55162cf4"
      }
    ],
    "parentId": "git-abd3a61",
    "author": "keqingwu5-cloud"
  },
  {
    "id": "git-398be14",
    "date": "2026-10-10",
    "ts": "2026-10-10T23:58:08+08:00",
    "bot": "director",
    "kind": "video",
    "title": "發佈 EP06 → n_q6",
    "summary": "用 scripts/publish_episode.sh 發佈。",
    "nodes": [
      "n_q6"
    ],
    "links": [
      {
        "label": "commit 398be14",
        "url": "https://github.com/keqingwu5-cloud/ai-boundary/commit/398be14f7890282063429ff6c073a842db0def81"
      }
    ],
    "parentId": "git-abd3a61",
    "author": "keqingwu5-cloud"
  },
  {
    "id": "git-d8463d3",
    "date": "2026-10-10",
    "ts": "2026-10-10T23:58:22+08:00",
    "bot": "unknown",
    "kind": "fix",
    "title": "加上快取版本，讓新影片顯示出來",
    "summary": "Cache-bust scripts so new videos show。",
    "nodes": [],
    "links": [
      {
        "label": "commit d8463d3",
        "url": "https://github.com/keqingwu5-cloud/ai-boundary/commit/d8463d34692dc88a56c1d26c3fb8081399a2a4cf"
      }
    ],
    "parentId": "git-398be14",
    "author": "keqingwu5-cloud"
  },
  {
    "id": "git-55cd548",
    "date": "2026-10-11",
    "ts": "2026-10-11T00:16:54+08:00",
    "bot": "unknown",
    "kind": "fix",
    "title": "iOS 短影音修正＋連續播放",
    "summary": "共用播放器、手勢解鎖聲音、▶ 備援、影集連續播放、手機轉檔（Main@3.1、30fps、1 秒 GOP）、版本檢查。",
    "nodes": [],
    "links": [
      {
        "label": "commit 55cd548",
        "url": "https://github.com/keqingwu5-cloud/ai-boundary/commit/55cd54879fdeedfb3335eb2b9154c44bb99fc46d"
      }
    ],
    "parentId": "git-4b45ed3",
    "author": "keqingwu5-cloud"
  },
  {
    "id": "git-4679534",
    "date": "2026-10-11",
    "ts": "2026-10-11T00:21:47+08:00",
    "bot": "unknown",
    "kind": "code",
    "title": "🎯 知識掌握度徽章＋說明區",
    "summary": "被動記錄看過的節點、停留時間、影片進度，算出掌握度（只存在這台裝置）。",
    "nodes": [],
    "links": [
      {
        "label": "commit 4679534",
        "url": "https://github.com/keqingwu5-cloud/ai-boundary/commit/46795349b56347ecb001214bc8c2422815c7ee2f"
      },
      {
        "label": "PR #1",
        "url": "https://github.com/keqingwu5-cloud/ai-boundary/pull/1"
      }
    ],
    "parentId": null,
    "author": "keqingwu5-cloud"
  },
  {
    "id": "pr-1-merged",
    "date": "2026-10-11",
    "ts": "2026-10-11T00:24:27+08:00",
    "bot": "unknown",
    "kind": "merge",
    "title": "合併 PR #1：知識掌握度",
    "summary": "knowledge-score 分支合併進 main。",
    "nodes": [],
    "links": [
      {
        "label": "PR #1",
        "url": "https://github.com/keqingwu5-cloud/ai-boundary/pull/1"
      },
      {
        "label": "merge commit fe1ed29",
        "url": "https://github.com/keqingwu5-cloud/ai-boundary/commit/fe1ed29eb0be7c0a539d41fa609b2ca6a6f7a4d0"
      }
    ],
    "parentId": "git-4679534",
    "author": "keqingwu5-cloud"
  },
  {
    "id": "git-8addd8f",
    "date": "2026-10-11",
    "ts": "2026-10-11T00:34:07+08:00",
    "bot": "decomposer",
    "kind": "content",
    "title": "問題拆解師：n_q1–q6 推理流程＋反證，5 個新方向",
    "summary": "SEED_PATCHES（推理流程、附來源的反證、botNotes）、SEED_EXTRAS 新增 5 個方向，登記 語言／思考／邊界 概念；只加不改。",
    "nodes": [
      "n_q1",
      "n_q2",
      "n_q3",
      "n_q4",
      "n_q5",
      "n_q6",
      "n_x_cot_faithful",
      "n_x_model_collapse",
      "n_x_alignment_faking",
      "n_x_cognitive_offloading",
      "n_x_latent_thought"
    ],
    "links": [
      {
        "label": "commit 8addd8f",
        "url": "https://github.com/keqingwu5-cloud/ai-boundary/commit/8addd8fa2c42d8d24243f06008299e9592c946ce"
      }
    ],
    "parentId": null,
    "author": "keqingwu5-cloud"
  },
  {
    "id": "git-e8d8600",
    "date": "2026-10-11",
    "ts": "2026-10-11T00:47:01+08:00",
    "bot": "unknown",
    "kind": "code",
    "title": "Supabase 雲端同步（第一版）",
    "summary": "config.js、sync.js／sync-core.js、schema.sql、vendored supabase-js、登入 UI 與同步狀態。在 PR #2（未合併）。",
    "nodes": [],
    "links": [
      {
        "label": "commit e8d8600",
        "url": "https://github.com/keqingwu5-cloud/ai-boundary/commit/e8d8600fcdeb72e1ff446871a47db34b0a156f0b"
      },
      {
        "label": "PR #2",
        "url": "https://github.com/keqingwu5-cloud/ai-boundary/pull/2"
      }
    ],
    "parentId": null,
    "author": "keqingwu5-cloud"
  },
  {
    "id": "git-d39d70a",
    "date": "2026-10-11",
    "ts": "2026-10-11T00:47:27+08:00",
    "bot": "unknown",
    "kind": "fix",
    "title": "修正：↩ 併回的歷程紀錄",
    "summary": "mergeBrain 的紀錄帶上 nodeId，節點面板與 🕘 生長紀錄都會顯示、可點。在 PR #2。",
    "nodes": [],